{
  "$schema": "http://json-schema.org/draft-07/schema#",
  "$id": "https://github.com/GaiaSenses/Gaiasenses-web/schemas/gaia.patch.schema.json",
  "title": "Manifesto de um patch Pure Data do GaiaSenses",
  "description": "Descreve uma composição sonora. Note que NÃO existe um campo de 'binding': quais dados o patch recebe é descoberto automaticamente lendo os objetos [r gaia.*] dentro do próprio patch.",
  "type": "object",
  "required": [
    "id",
    "label",
    "author",
    "license",
    "activation"
  ],
  "additionalProperties": false,
  "properties": {
    "$schema": {
      "type": "string"
    },
    "schemaVersion": {
      "type": "integer",
      "const": 1
    },
    "id": {
      "type": "string",
      "pattern": "^[a-zA-Z0-9][a-zA-Z0-9-]{1,39}$",
      "description": "Identificador único, igual ao nome da pasta em patches/. Prefira minúsculas com hífen."
    },
    "label": {
      "type": "string",
      "minLength": 1,
      "maxLength": 60,
      "description": "Nome que aparece na interface do GaiaSenses."
    },
    "description": {
      "type": "string",
      "maxLength": 500,
      "description": "Uma ou duas frases sobre a peça."
    },
    "author": {
      "type": "object",
      "required": [
        "name"
      ],
      "additionalProperties": false,
      "properties": {
        "name": {
          "type": "string",
          "minLength": 1
        },
        "github": {
          "type": "string"
        },
        "email": {
          "type": "string"
        }
      }
    },
    "license": {
      "type": "string",
      "minLength": 2,
      "description": "Ex.: CC-BY-4.0, CC-BY-SA-4.0, CC0-1.0."
    },
    "build": {
      "type": "object",
      "additionalProperties": false,
      "properties": {
        "initialMemory": {
          "type": "integer",
          "enum": [
            32,
            64,
            128,
            256,
            512
          ],
          "default": 64,
          "description": "Memória em MB. Aumente se o patch usar muitas vozes ou samples grandes."
        },
        "patchZoom": {
          "type": "number",
          "minimum": 1,
          "maximum": 4
        },
        "prebuilt": {
          "type": "boolean",
          "default": false,
          "description": "Use apenas quando o patch ainda não compila na versão atual do pd4web. O bundle já existente é reaproveitado em vez de recompilado. Exige 'prebuiltReason'."
        },
        "prebuiltReason": {
          "type": "string",
          "description": "Por que este patch não pode ser recompilado ainda, e o que precisa mudar para que possa."
        },
        "prebuiltFrom": {
          "type": "string",
          "description": "Pasta em public/ de onde o bundle já compilado deve ser copiado."
        }
      }
    },
    "activation": {
      "type": "object",
      "required": [
        "moments"
      ],
      "additionalProperties": false,
      "properties": {
        "moments": {
          "type": "array",
          "minItems": 1,
          "uniqueItems": true,
          "items": {
            "type": "string",
            "enum": [
              "map",
              "player"
            ]
          },
          "description": "\"map\" = toca no globo. \"player\" = toca junto com uma animação."
        },
        "compositions": {
          "type": "array",
          "uniqueItems": true,
          "items": {
            "type": "string"
          },
          "description": "Animações p5 com as quais este patch toca. Precisa bater com os nomes de AvailableCompositionNames."
        }
      }
    },
    "tuning": {
      "type": "object",
      "additionalProperties": false,
      "description": "Ajuste fino do envio de dados. Os valores padrão servem para quase todo patch.",
      "properties": {
        "pollMs": {
          "type": "integer",
          "minimum": 16,
          "maximum": 5000,
          "default": 100,
          "description": "De quanto em quanto tempo (ms) a posição do globo é enviada."
        },
        "epsilon": {
          "type": "number",
          "minimum": 0,
          "default": 0.0001,
          "description": "Variação mínima em graus para reenviar latitude/longitude."
        },
        "accEpsilon": {
          "type": "number",
          "minimum": 0,
          "default": 0.05,
          "description": "Variação mínima para reenviar acelerômetro e CO₂."
        }
      }
    },
    "skipReceiverCheck": {
      "type": "boolean",
      "default": false,
      "description": "Desliga a checagem de receivers. Use apenas se o patch monta nomes dinamicamente, e explique o motivo no PR."
    }
  }
}
