{
  "$schema": "../../schemas/gaia.patch.schema.json",
  "schemaVersion": 1,
  "id": "thunder4",
  "label": "Thunder 4",
  "description": "Trovoadas disparadas a cada raio desenhado pela animação lightningBolts.",
  "author": { "name": "Equipe GaiaSenses" },
  "license": "CC-BY-4.0",
  "build": { "initialMemory": 64 },
  "activation": { "moments": ["player"], "compositions": ["lightningBolts"] }
}
