{
  "$schema": "../../schemas/gaia.patch.schema.json",
  "schemaVersion": 1,
  "id": "paraisoGaia43",
  "label": "Map sound 43",
  "description": "Paisagem sonora do globo. Responde à posição do mapa, ao sensor Bolota e devolve coordenadas que movem o globo.",
  "author": {
    "name": "Equipe GaiaSenses"
  },
  "license": "CC-BY-4.0",
  "build": {
    "initialMemory": 64,
    "prebuilt": true,
    "prebuiltFrom": "paraisoGaia43",
    "prebuiltReason": "O pd4web 3.3 aceita apenas um graph no patch principal, e este tem mais de um (o subpatch 'anotações' contém outro). O bundle atual, compilado com uma versão anterior, continua sendo usado. Para voltar a compilar: consolidar os graphs do patch principal em um só."
  },
  "activation": {
    "moments": [
      "map",
      "player"
    ]
  },
  "tuning": {
    "pollMs": 64,
    "epsilon": 0.5,
    "accEpsilon": 0.05
  }
}
